{
  "schema_version": "1.0",
  "candidate_id": "candidate-update-001",
  "operation": "update",
  "target_doc_id": "doc:synthetic-001",
  "target_relative_path": "content/existing.md",
  "base_sha256": "aaaaaaaaaaaaaaaaaaaaaaaaaaaaaaaaaaaaaaaaaaaaaaaaaaaaaaaaaaaaaaaa",
  "proposed_frontmatter": {
    "title": "Synthetic existing document",
    "tags": "fixture, reviewed",
    "doc_id": "doc:synthetic-001"
  },
  "proposed_body": "# Synthetic existing document\n\nReviewed fixture update.",
  "source_refs": [
    {
      "type": "synthetic-test",
      "reference": "fixture://conversation/002"
    }
  ],
  "sensitivity": "internal",
  "created_at": "2026-08-29T00:01:00Z"
}
